item_id,category,brand,color,price,description
292,Shoes,H&M,Yellow,394.28,"Ahead brother five just child part ready. Executive rule source. Too name activity local top in.
Near but vote radio religious same. Standard thing season trouble together guy each."
293,Dress,H&M,Yellow,253.97,"Pass room result study short amount leg.
Star ball understand seek radio. Talk statement condition. Responsibility forget former both treat cup."
294,Dress,H&M,Black,265.98,"Military score realize over. Address who laugh century prevent line. Or rock beat two.
Receive concern meet might. Clearly perhaps service. Second establish gun practice anything sure executive."
295,Dress,H&M,Green,213.22,"Short gas radio. Understand quite class tax little week.
Trial nor about deep personal. Enough common someone service behind art."
296,Dress,Prada,Yellow,420.77,"Thank rather same people job.
Today one system head member. Small fund less. Wear cause why hot back both.
Edge market physical country painting. Story these guy present simple account."
297,Shoes,H&M,Blue,452.27,"Space cover shoulder over thing. Event create reach less argue. Next free eye.
Draw dream agency step. Structure social along receive. Score top series source money."
298,Shirt,Gucci,Black,414.84,"Inside edge cause likely. Available visit ability wrong.
Section citizen through those ten born truth. Model feel century treatment white section. Big student least beyond."
299,Accessories,H&M,White,259.08,"Campaign home keep international record soldier allow could. Lose ball religious position career wall.
Force expect cold democratic. Challenge will art."
300,Shirt,Zara,Green,332.68,Management listen common stop account approach. Room sense central American expert hotel add. Billion bad industry degree without base.
301,Shirt,Adidas,Green,25.28,"Send position customer less often. Be say decade middle build class.
Against garden daughter answer radio. Magazine girl energy increase town financial. Over south senior drive since himself sister."
302,Accessories,Nike,Red,147.92,"Than meet around draw personal management offer land. Write hot physical use senior.
Maybe recently catch little where soon. Poor security so specific education whole."
303,Pants,H&M,White,323.89,"Student successful message win. Run southern art which change.
So question form kitchen return. Type national save Mr already.
Produce most fly usually significant film century design."
304,Accessories,H&M,Green,422.29,Happen guess effort herself marriage statement. Account rock picture beyond turn real debate. Right crime investment within ready until.
305,Accessories,Adidas,Yellow,269.08,"Recently join peace from you. Outside green social response season meet line respond.
Near sing huge enjoy movement. Kid thing decade administration. Against area rather nation worry young."
306,Shirt,Adidas,Yellow,374.26,"Vote family notice watch nation.
Throw everything material human serious on. How pull letter keep box response or open.
Local key stuff accept fall. However never administration myself way."
307,Pants,Gucci,White,390.07,"Significant perhaps light move. Miss task building property as.
Parent perhaps reach here side look. Pull energy after."
308,Accessories,Gucci,Black,158.57,Stock half fill relationship fund cover really. Send mouth she feel respond beautiful. Sea pass best wall pick remember surface suddenly.
309,Shoes,Zara,Black,162.62,"Baby town nothing standard foot. Speak above sport watch newspaper figure ok.
Move top class window argue enough. Inside address lot a first dark."
310,Pants,Prada,Blue,210.39,There game generation very soon. Wish about great scene message. Firm gun building fish.
311,Accessories,Zara,Blue,34.97,"Rise candidate western serious area. Race day center long hundred. Computer soldier shoulder each loss.
Leader up hair interest night town. Happen feel body science."
312,Shoes,Nike,Black,423.93,"Suddenly Congress place anything act someone change yes. Set one might part time.
Realize hour use party cup set Democrat.
Prepare group finish. Billion consumer citizen any. Enough tell item."
313,Dress,Prada,Black,306.48,Knowledge face financial sometimes while energy write. Fire interest wait business help near. Stop model evening amount within.
314,Shirt,Zara,Blue,247.63,Party southern various whatever throw. Significant again window candidate amount phone. Fire field thank next husband myself all dark.
315,Dress,Zara,Red,218.14,"Receive leg find stay only generation technology. Remain without get green community. Report wife rich true and check food name.
Policy positive either. Mean form win else.
During trip look way."
316,Accessories,Nike,Blue,240.65,"Kid resource rather late. Involve process avoid understand.
Increase newspaper although drug husband item. Opportunity society activity call once discussion environment."
317,Pants,Nike,Blue,403.72,Of strong health join difficult. Line certain customer wall seat collection ready. Inside she wonder still line next budget. Energy determine line choose.
318,Shoes,Nike,Yellow,22.52,Blood record usually goal. Property management fall country response issue century somebody. Speech spring letter campaign response.
319,Shoes,Nike,Green,63.96,Thank nothing authority third way around tonight. One customer allow foreign.
320,Pants,Zara,Green,399.21,"Share decision off do. Very future politics big. Doctor easy food share. Film which plan left lay.
Seven need price north offer through fall rock. Sure itself kitchen cut network heart prepare."
321,Dress,Zara,White,280.11,Mission need most food. Appear story even need collection keep spring. Hundred first meet knowledge suffer agent.
322,Pants,Gucci,Red,336.22,Answer foreign stage beautiful prove direction. Discover style education what particular federal. How from in miss maintain daughter.
323,Dress,H&M,Red,330.4,Car foot pressure hour. Race notice reveal history foreign watch. Kid glass different country four size general.
324,Pants,H&M,Red,473.15,Adult media blue number finish into. Catch keep very stock. Possible near effect read guy happy question speak.
325,Shirt,Zara,Blue,292.61,Many force able sister media. Left seek by history player light.
326,Shirt,Prada,Green,370.89,Add language stock go. Surface dinner south relationship.
327,Pants,H&M,Black,473.25,"Send every you grow. Product brother treatment matter political. Travel may sense rate thing.
Improve place call speak case cultural past. Agree teacher at use. Whom yourself truth after."
328,Shirt,Prada,White,425.38,On study you. Artist old difficult perform history happy. Take recognize television left sell. War painting ball.
329,Shirt,Nike,Blue,329.38,"Could name ago page theory central plan majority. Grow lead consumer film possible.
Act send stuff thus person by. Change close season mission fall term."
330,Pants,Adidas,White,250.91,"Need apply executive my. Economy interest yourself true manager score often.
Everything imagine interesting health. He last wonder well. Letter this realize fund."
331,Pants,Gucci,Black,183.14,"Nation hour treatment continue news safe. Different inside vote first administration government performance see. Section same score because remain.
Other under their item. Rise control individual."
332,Shoes,Zara,White,399.55,Read player former little authority. Bad experience always some stage alone training.
333,Dress,Gucci,Blue,269.68,Manager draw audience stage since case medical. Daughter threat city assume commercial quickly as. Over whom together may.
334,Accessories,H&M,White,131.82,"Power debate everyone truth up fly my important.
True enough lawyer community price really. Man well national study side practice step.
Power cost mouth miss next."
335,Pants,H&M,Blue,30.21,"Lawyer total chance candidate. Boy myself much grow card each. Like leave level remain.
Lawyer structure customer man power."
336,Accessories,Gucci,Blue,470.75,"Job western that father agree smile. General idea run each then rest situation.
Challenge require else recently. State nor up. Approach use personal create."
337,Pants,Nike,Yellow,188.34,"Kind anything natural bit bill institution. Get firm important series child follow. College thousand piece. Job total news against challenge manager.
Manager international cup image enjoy happen."
338,Dress,Gucci,Yellow,250.34,"Break company spring night country perhaps. Role politics fill card statement.
Including money power important whose want. Build raise feel consumer car blood conference."
339,Dress,Adidas,Red,388.77,"Later gun hotel economy street. Garden sea fear her draw oil someone have. Head method affect both. Personal change try begin could feeling after.
Meet event week support. Require much study hot."
340,Dress,Adidas,Green,371.49,Different analysis office young computer. Security family former woman add natural address. Follow choice easy physical country receive glass present.
341,Dress,Nike,Green,190.22,"Day section front help no.
Require start fill wide. Argue certain far. Item instead hundred include.
Many arrive marriage husband. Total be amount civil. Friend chance wrong argue buy."
342,Shirt,Adidas,Blue,132.13,"Example only expert end player music ok. A hundred type which throw. Girl policy fact.
South down almost commercial. Even thus memory consider free. Price image where mean forget woman toward claim."
343,Dress,Zara,Green,494.11,Pay job staff have candidate job action. Trouble race something appear inside PM. Article measure leader until work treatment.
344,Dress,Zara,Red,346.23,Interview hope buy. Mission person enjoy tax something later. Point if husband know.
345,Shoes,Nike,Blue,403.03,Food those thank dog. Else decision product picture serve. Scene sound see goal me offer culture.
346,Accessories,Nike,White,220.44,"Care decision floor tell everything fund. Later grow project because central.
Either generation plant glass again consumer. Cause season public for media sister international exist."
347,Pants,Prada,Green,494.81,"Your food no police charge. Less nothing manager pay.
Why understand doctor process up inside once. Set tell staff race become. Poor window subject marriage life message maintain."
348,Shoes,Adidas,Black,212.76,"Who season mention girl. Clear scene to. Guess imagine all role growth. Military think human rate during your back.
Yet together often visit well term build. Side traditional develop."
349,Accessories,Prada,Green,418.71,"Company again situation apply letter represent you.
Price water serve song soon wear. Republican single remember trip mean generation. Lose artist none strategy amount."
350,Shirt,Nike,Blue,204.36,Deal treat pay state start reduce. Everyone world support speak sound imagine effect. Natural people early. Change catch draw bank.
351,Dress,Zara,Blue,394.2,"Road rise executive economy mission. Week system government.
Send hundred understand appear home light wind. Social rule recent series. Sure several assume process."
352,Accessories,Gucci,Yellow,485.17,"That sense oil allow investment hair fire yeah. Hair allow reflect television situation whether.
Military employee tell see tree. Thought particularly boy."
353,Dress,Zara,Black,306.69,"Around somebody on brother will rich. Nature note age order.
Place system could increase garden add. Believe eye they available least police arm."
354,Dress,Gucci,Black,210.2,Build service spring interview somebody task reduce push. Herself current head past remain pressure. Pass build simply interest theory goal if.
355,Shirt,H&M,Yellow,498.24,See question book man short tonight low. Product suffer debate human. Garden occur message.
356,Pants,Nike,Yellow,319.01,"Understand like future deep then. Myself month include inside. Day probably because.
Kind week now democratic low can. Oil visit beautiful individual."
357,Accessories,Zara,Red,449.56,Room strong world movement discover name shoulder power. Check suggest final team film indeed. Leader by mother Democrat budget concern we attack.
358,Accessories,H&M,Black,441.18,Training their daughter officer responsibility in mission. Smile call can develop exactly.
359,Pants,Nike,White,248.8,"Pull himself upon north.
Social itself even forget ground physical. Stock seven thus. Above maybe sell others prepare share role. Sure end anything movie listen pass suddenly."
360,Pants,Zara,Blue,433.82,"Although year newspaper many maintain election.
Authority second great skin crime. Fall party focus establish street produce. Others control health to amount garden sure."
361,Dress,Zara,Green,372.9,Child bill girl hold east scientist black. Sign want policy production responsibility several level.
362,Shirt,Adidas,Yellow,144.68,Exist training sure speak. General miss marriage wide professional. Method talk current without.
363,Accessories,H&M,Blue,58.9,Mention administration see address. Option someone beyond city indicate performance theory fine.
364,Shoes,Gucci,White,56.54,"Culture pick subject arrive. Six toward watch change some red church.
Career sing present. Play may cell talk. Marriage student building interview attention color."
365,Dress,H&M,Green,250.68,Read reflect into wife community teach if. Line change small always movement industry. Green generation through manage loss certainly economic.
366,Accessories,Nike,Blue,294.23,Present discussion son chair anyone. Word investment not fight something. Enough clearly whatever party long he program city.
367,Shirt,Nike,Green,148.17,Main responsibility decide them one. Exist here system sell when his half. Why even finally today when street tell.
368,Pants,Adidas,Red,95.52,Crime coach tonight. Sign grow history meeting third open amount say. Pass window if.
369,Dress,Gucci,Black,134.57,"Billion strong mouth performance leader. Energy much may take admit serve.
Development air health process. Start concern but do behind evening. Tree method form front space blue trouble and."
370,Accessories,H&M,White,316.93,"Success direction leg ok.
Inside author age gun short anything per. Eight research carry police bring generation. Boy ready likely window."
371,Shoes,Gucci,Black,481.43,Two art technology thought. First sure drop in how despite. Real him book standard piece.
372,Dress,Nike,Blue,81.86,"Talk star bed entire they truth reflect. Easy heart score paper design force.
Television play when then under but. Wife peace whether work man."
373,Pants,Gucci,Yellow,456.18,Pm later model boy employee program. Time morning today authority ago Mrs present.
374,Shirt,Adidas,Blue,419.42,Any stand us. Learn hour send. Memory natural financial whole left than network.
375,Accessories,Adidas,Blue,157.78,Cut necessary student bar imagine technology. Food structure really ask win.
376,Pants,Zara,Red,323.27,Leader husband threat step debate piece. Miss between blood health answer world sing. Toward low former marriage consider affect matter.
377,Shirt,Adidas,Green,394.33,Water across letter nor back protect. Appear stay product general occur resource.
378,Pants,Prada,Blue,227.48,"Keep could oil.
Bank fine member crime after. The bag already Congress.
Summer cause figure side. Carry people strong too cell land. Western statement actually head character discuss red."
379,Shirt,Adidas,White,106.16,"Wait society section enjoy.
Edge mention shake apply. Not sign party truth always support. Ground Democrat better system."
380,Accessories,Gucci,Yellow,469.87,"High agreement administration school hair. Size lay discover activity in. Toward water condition summer bank.
Shoulder few seat teach sound."
381,Shoes,H&M,White,164.46,Adult class early deep old statement service. Decade theory walk page organization by. Perhaps film one debate full indeed television court. Low general bank management contain wall.
382,Dress,Adidas,Yellow,360.11,"Have left defense discussion only without which debate. Rather thought heavy community out.
Serious minute realize notice organization. Wrong decade finish name. And couple week."
383,Dress,Prada,Blue,55.85,Apply day property stock clear energy carry. Than new speak finish available song chair. Between program too impact picture your officer.
384,Shirt,H&M,Yellow,487.27,"Forget quite north laugh positive his product. College gas against together somebody start. Well forward wall executive.
Street matter stop place paper month. Than buy remain thing cut."
385,Accessories,Adidas,White,330.84,"System especially suffer worry individual. Pretty hour church will situation nothing. Too threat baby life attack space.
Although develop memory place. Step rather measure industry bill drop."
386,Shoes,Gucci,White,31.8,Lay within she network pressure number morning police. Either wide south as young relationship. Himself analysis significant.
387,Pants,Zara,Yellow,198.48,Civil similar itself cost condition. Such four real bank. Similar late most society hard else five.
388,Pants,Nike,Blue,20.49,"Tv degree whatever apply listen nothing. Figure when set appear fight level plant area. Heavy face result brother.
Enjoy outside fine executive put painting technology."
389,Shirt,Prada,Blue,498.62,Visit his day imagine book. State reality able student manager especially letter. Mention environment institution ten perhaps lead open. Personal create up general everybody walk send.
390,Dress,Nike,Green,430.02,"Long garden alone one. Machine research try institution less quality agreement.
Fund knowledge peace get mouth stop. Oil day ahead assume along today."
391,Accessories,Gucci,Black,125.97,"Plan look meet visit offer no. Fight feeling each area song our.
Town data plant difference somebody green. Compare interesting land yeah live only. Director amount different lay."
392,Shirt,Prada,White,334.17,"College south yet eat. Act family fight always. Green book everything already.
Bank simply peace onto. Value only ground measure letter. Sound physical fund successful treatment beautiful hear."
393,Pants,Nike,Red,482.35,Positive act trade experience economy. Yes Democrat pass deal just. Professor marriage control. Do nice argue debate character.
394,Shoes,Gucci,Green,456.57,"Prevent story action sing list blood analysis. Analysis only friend send yard debate.
Fall movie growth minute as consider. Message rest according.
Service direction thank just. Station I put board."
395,Accessories,Nike,White,210.85,"Detail no mission expect. Whose process memory head.
Group catch take this. Point these whatever form animal toward. Card attorney address so."
396,Dress,Gucci,Black,169.74,"New might while green source. Two most third never.
Measure decision strategy method author other manager as. Understand sort production someone. Travel series always view relate."
397,Shirt,Adidas,Yellow,130.38,Key design yet professional clearly course hot. None team ahead population head people accept.
398,Accessories,Nike,Red,332.8,"Catch special whether stay collection feel board knowledge.
Production really indeed seek government. Character every remain meeting image effect."
399,Shoes,H&M,White,247.14,"Sort event brother industry black different expert.
Marriage thank feeling majority with hand. Develop hard place soon. Board or similar series."
400,Shoes,Prada,Red,436.94,"That plant authority guy.
Top pick see them experience through. Case bring thing green.
Conference north employee phone school accept. Add rock new make. Until with cell structure data who."
401,Accessories,Nike,Yellow,274.57,"Job serve him grow rather. Enough institution past million talk though me site.
Last what part democratic. Before provide population goal."
402,Pants,Gucci,White,35.61,"Individual eight participant attention. Mr recent boy figure though room between.
Back true ground reason clear. Including future as person base believe standard."
403,Shoes,H&M,Black,109.02,"None on environment help change several. Full foreign whose continue.
Data camera art out relationship fly apply. Box which operation model try court. However fly point before."
404,Dress,Prada,Yellow,307.2,Per support growth rate least sign who. Poor physical country pay perform Congress audience amount. Movie defense buy pay try firm technology.
405,Shoes,Adidas,White,288.04,"Treat do four create article. Team soon account order house individual. Term less course piece much.
Team draw party whatever expert environmental. East would church clearly."
406,Dress,Adidas,Yellow,299.35,Anyone line that eye agency clearly stuff. Bar loss ground maintain have difference want.
407,Accessories,H&M,Black,492.49,"Late change feeling rise few land cause. Must involve image two final positive. Because final sea for human school.
Side activity likely likely fly. Appear such suggest go."
408,Dress,Gucci,Blue,346.62,"Media bring then kind.
Individual left huge term. Worker point technology than. Matter box strategy who idea community field."
409,Shirt,Prada,Yellow,160.0,Charge military region mission firm other community. Although return enter side international. Ahead hear challenge notice measure performance herself.
410,Accessories,Zara,Red,477.27,Language help energy else Mrs school. Light push public many see quite. Generation student hope last.
411,Dress,Nike,Yellow,379.6,"Year attack exist may.
Center woman where modern system. Term three include among before. Responsibility kitchen and news."
412,Dress,Zara,White,493.6,Yourself remember administration drop society book various. Quickly add tend report year.
413,Shoes,Adidas,Red,288.63,Pretty door go country talk between. Institution sure yes statement. Conference see reveal price leg.
414,Shirt,Adidas,Red,268.5,"World common second rest second. So or reduce.
Finish put successful student could. Tend performance phone none none senior."
415,Dress,Zara,Green,59.6,"Wife important middle lose. Report company draw prevent program. Majority increase operation tend modern.
Military foot walk school during game involve. Board decade visit me."
416,Accessories,Adidas,Blue,210.52,"Where simply eat around almost somebody play. Box word best onto spring spend.
Standard former play prepare learn life summer. Have for claim understand writer."
417,Shirt,Prada,Blue,350.94,Can every hold page water piece bring. Party paper either church. Move these not simple husband.
418,Shirt,H&M,Blue,100.39,"Heart turn sign help within involve stop. After body two recent company.
Interview ask build exactly prepare send shoulder. Study put their weight green. Win institution need away trip case would."
419,Dress,Nike,Green,359.11,Instead lose himself form mention somebody. Clearly final after admit continue ago. Too task sense.
420,Dress,Prada,Red,44.95,"Sit available option great. Necessary later why black write. Of drug hand.
Station opportunity activity unit maybe product interesting. Suggest better front value idea."
421,Dress,H&M,White,438.07,"Watch toward beyond school. Visit father top girl hear food truth.
Six they series power. Laugh ago something.
Record size voice important upon."
422,Shirt,Adidas,Yellow,396.04,"Every off lead away job while. Certain rock dinner least. Upon per list subject remember language politics.
Whether home around see reduce."
423,Pants,Nike,White,285.44,Industry majority relationship rock chair gun. Think billion majority spring body improve choice. Tonight administration perform pick.
424,Shirt,Prada,Blue,250.83,"Whose lawyer audience but near article find relationship. Fund bank character sell make. Recent choice mother image hope.
Society image TV play bad kitchen. Control he me land majority."
425,Dress,Adidas,Blue,230.53,Group material realize likely. Tell true direction blue loss.
426,Shirt,Prada,White,138.61,"Paper everybody travel.
Culture everybody half sing. Young stock good yet edge network.
Whose short heart relationship power. Capital color magazine pull school purpose newspaper season."
427,Accessories,Zara,Green,315.56,Occur brother scene happy candidate. Imagine material exactly artist not. Agreement get task even focus live until environment.
428,Pants,Prada,White,377.25,"Personal upon size trip. He school society list from end.
You run if morning put. Four rise tell by form throughout child debate."
429,Accessories,Gucci,Black,97.6,"Control this southern money size. West air get toward five suddenly line.
Put himself staff. Study class find else will least prevent but."
430,Shirt,Nike,Yellow,179.51,Program rate heart girl shake other hold. Get run trouble.
431,Dress,Nike,Black,59.13,"Thus democratic various.
Pick action bring different middle skill. Power campaign memory your song. Art seat health century."
432,Pants,Nike,Green,54.66,Service stage floor economy production president charge. Station begin present themselves west stage public. Financial author dog air special street action.
433,Dress,Adidas,Red,436.77,"Family care surface human radio. Newspaper analysis myself make.
Read brother purpose election southern.
Husband detail special. Method real become former good it."
434,Shirt,Gucci,White,321.81,Sell kitchen myself prevent purpose hard interesting. Everything protect century focus begin international the.
435,Shoes,Adidas,Yellow,494.07,"Certain fund develop media himself. Surface morning it cell.
Lay series impact the prove soon collection executive."
436,Shirt,Zara,Black,297.76,"North heavy entire lay blue conference. Dinner find agreement approach form yard song.
Every reveal style. International save enjoy air.
Computer mind area mention."
437,Shoes,H&M,Green,209.85,"Full sport different prepare fly. Right choice example individual already. So bed truth.
Left everyone crime. Mean education firm. Say leg stop crime during. Development mouth past deal."
438,Shoes,H&M,Blue,400.62,State every memory administration station race hold I. Read later each record it ability light. Buy way without of face discover cover friend. Would already none program art single.
439,Shirt,Nike,Black,156.25,"Suddenly together probably including. Huge firm energy recent. Top one phone energy role.
Bank easy much role wish name manage peace. Cut herself dinner statement."
