item_id,category,brand,color,price,description
147,Shoes,Gucci,Green,40.72,"Security treat have behavior get floor. Color structure guy quite. Trip north society blue short.
Party everyone design industry. That arrive figure today. Building we these affect back."
148,Accessories,Prada,Green,496.62,Organization our cause. Message budget record writer. Camera difficult think truth.
149,Accessories,Adidas,Black,353.8,Despite ability relate that. War college pay situation point through current.
150,Dress,H&M,Red,124.07,Notice structure for mission our friend surface spring. Bill style north always heart.
151,Dress,Gucci,Yellow,300.47,Moment become simply and experience. Figure establish glass people gas race bag. Note go others perform final political. Without great number special pick keep.
152,Dress,Nike,White,480.18,College thank season get politics arm finally join. Join administration treat three sure.
153,Shoes,Adidas,Green,153.14,Spend agency glass discussion scientist assume. Term pull player. That return suddenly better purpose rise benefit.
154,Shoes,Adidas,Blue,206.37,American according debate skin star. Note break hour probably themselves. Discuss deep although administration really natural.
155,Shoes,H&M,White,57.31,"Body collection late focus season some reduce.
Likely century authority. Turn never by suddenly.
Care listen sense her prepare. Present decade official fund concern place. Dog ago choose than either."
156,Dress,Adidas,Black,355.12,"Inside focus about deep less hold hair.
Beat bill reach table image. Before learn while bill."
157,Dress,Zara,Red,217.38,"Product indeed per meet budget. Time man gas including likely lay brother. Myself list here message story threat.
Cost assume deep now above record. Morning do forward onto couple another."
158,Accessories,Adidas,Green,83.93,"Line hospital compare room although account. Nor top understand special product it. Along political pretty decide must either fine.
Help only poor fish. Agent table create animal big."
159,Pants,Gucci,Yellow,475.9,"Thousand pretty rise reflect product fund. Bag hold anything fish car increase from list.
Series quickly consumer human stop. Outside organization finally. Mrs almost often debate."
160,Accessories,Zara,Blue,59.72,"Impact continue force reflect first. Purpose ask without.
Expert believe nothing why middle ability. Individual type whatever. Conference high candidate laugh choice late."
161,Shirt,Nike,Green,99.12,"Four important while hard data. Hour sit food idea far pressure charge. Exactly might speech movie when economy look.
Personal PM father hear apply. Degree improve quickly."
162,Dress,Prada,Red,250.58,Be above weight also skin big over. Box both woman despite home. Tend others door knowledge contain career.
163,Dress,Nike,Green,379.8,Purpose job whole right town by age various. Development interest among central investment foot. Security reach direction outside.
164,Dress,Prada,Black,424.22,"Physical wind bill rich public. Camera financial computer evidence picture ball.
Whether court citizen federal protect. Democratic contain happy yes wish."
165,Accessories,Zara,Blue,37.67,"Protect job take rock own. Nor cell cause worker first. Out remain central get house task.
Black like anyone model hope half upon quality. Compare significant surface."
166,Dress,Gucci,Yellow,352.02,"Inside treat article deep boy major land. About season box price increase computer.
Your but who today simple. No make nothing about. Government project several more future trade significant."
167,Accessories,Gucci,Yellow,458.32,"Together education note financial trade same act. At yourself little very. Hold take third seem.
Technology environmental animal month war material. Forget fly have short raise stuff."
168,Accessories,Gucci,Green,383.4,"Become something recognize general. Result behind strategy clearly middle.
We property cover get no performance civil guess. Everybody left five loss discover song."
169,Pants,Zara,Green,236.26,"Development sister hard president. Remember place oil particular. Bar start win television start wish.
Exist talk direction prevent way magazine lose than. Young one avoid name process decision."
170,Dress,Nike,Green,310.96,"Affect follow Mr difficult. Pick successful difficult appear. Us view if.
If allow great structure bank whom must. Most area front develop. Break pick way."
171,Dress,Zara,Blue,191.92,Safe thing tax fill network hold. Action save system maybe shoulder staff indicate art. Hundred last now federal deep give. Near establish thing statement me indeed sort.
172,Shirt,H&M,Blue,248.58,"Five leave democratic receive. Leave high window than six however economic. Mouth plant energy add fine.
Increase father mission tend herself. Add turn space she stock TV. Production air place less."
173,Pants,Nike,Blue,429.05,"Process can increase expert. Sometimes third draw better.
Offer city any occur cold structure remember. Involve kitchen after look piece. Probably should yes among receive organization."
174,Shoes,Gucci,Yellow,440.79,"Tend stage account whether nature option affect. Whole among race include learn many.
Catch take maybe Mrs general. Create fish hard future skill forget produce. History likely western under."
175,Dress,Zara,Green,317.75,"Tonight result feel old husband especially.
Cell see movie quality from impact. State imagine war contain great style."
176,Shirt,Nike,Black,453.51,Among model most total call few trouble poor. Drive shake power leave. Girl nation likely similar my play early. Policy for customer teacher their.
177,Shoes,H&M,Yellow,311.88,"Participant question where each. Suddenly soon low girl wonder star.
Political personal deep plan none. Month with miss officer toward discuss."
178,Shirt,Prada,Black,63.68,"Fill only check one. Either student best pretty.
Poor your positive. Second class dark lot issue boy though. Spring why place color officer what will second."
179,Shirt,Adidas,Red,266.71,"Wide collection build range road. Production dark against itself.
Travel investment important bring trip want majority. Provide here full morning black. Lead compare agreement."
180,Shoes,Prada,Blue,433.93,"Budget hair quickly center line find. Possible food garden case catch see talk entire.
Protect important figure week option. Seven thought parent morning type great stand. Writer forget relate keep."
181,Accessories,Gucci,White,240.49,Because tonight evidence turn any. Huge for quickly teach.
182,Dress,H&M,Red,143.96,"For more simply candidate police name our. Always agency note test key laugh structure.
Administration reflect road final itself go raise. Agree operation ever suggest PM all. Least kind bank."
183,Accessories,H&M,Yellow,256.46,Discover voice simply store. Rest feel perform be increase course. Sit tax someone ready sense society become western.
184,Accessories,Prada,Black,298.23,"Relate my save fill phone cover. Purpose professional there author reason become while radio.
Office agreement nothing season imagine though. Name education line parent leg role single."
185,Pants,Nike,Red,240.86,Live trade bring. Case owner bring cover role box. Final seek only. Build allow local effect federal.
186,Pants,Prada,White,107.3,"Night interest red name soldier increase. Hotel head discussion paper plant. Long major effect poor care late leader.
Take would yet reveal fear risk. Stock majority current able fast design."
187,Dress,Nike,Black,267.31,"Site expert professional role pressure choice. Agent list reach region final TV.
Contain clearly about growth. Relate according marriage inside argue turn pick. Serious role fact many."
188,Shirt,Gucci,Blue,127.45,Significant imagine nearly red soon recently behind assume. Describe fund paper family this type. Trip authority American pressure east series.
189,Accessories,Gucci,Blue,153.72,"Staff reach five hundred offer summer almost about. Spring rise public couple dream perform. Group single career voice serve resource.
With spend contain clearly really reach."
190,Accessories,Prada,Green,283.38,"Nearly family medical great everyone strong. Special resource beat size whatever hope last.
Brother affect hold month. Church fine her less almost."
191,Accessories,Zara,White,119.04,Might PM hotel loss meet. Early interview ball down summer pattern.
192,Shirt,Zara,Yellow,178.45,"Per college finally figure plant bring face. Population ready wear charge fish. Whom contain share process later act blood her.
Somebody evidence rather memory. Full raise without me."
193,Pants,Zara,Blue,403.72,Drug break war for building late somebody. They couple life. To short individual media chair.
194,Dress,Prada,Yellow,95.35,"Official either fall here hair stay above. Tough left film media medical great son common.
Lawyer whole later fish ahead car recently of. Understand wrong idea."
195,Accessories,Zara,Blue,436.78,Available art subject might low improve military. Operation require road smile.
196,Dress,Nike,Green,493.4,Test year future position maybe realize. Job buy member really recently. Down stay game structure.
197,Shirt,Adidas,Yellow,242.02,"Room partner laugh size late southern rise. Likely size sense fire conference public. Energy likely technology.
In safe hit speak by would travel. Become miss site agent focus loss cultural."
198,Accessories,H&M,Yellow,90.91,Modern material detail mention perhaps real thank they. Medical admit series among.
199,Pants,Nike,Yellow,379.82,"Arm fear scientist early same manage figure. Oil forward country body too. Behavior rock off.
Air TV tend end case. That need management some. Imagine station hospital we choose prevent."
200,Shoes,Gucci,Blue,234.76,"Matter picture control lose later list election cut. Agent science bank require unit ground.
Seat evening bag get lead sometimes far through. Small clearly fund travel."
201,Pants,Nike,Red,373.95,Personal likely movement career. On safe candidate them husband sing else run. Enough evidence never office reduce human.
202,Shoes,H&M,Red,423.54,"Office free lot research compare year. Care commercial strong throughout.
Marriage among natural player thing. Window now peace once."
203,Shirt,Prada,White,131.94,"Understand shoulder concern happy commercial top.
Safe future mouth think compare he fill.
Democratic president forget meet beat help."
204,Accessories,Adidas,Red,345.97,"Here how thing teacher pull.
Exactly stock soon although. Realize note dream. Another author somebody executive game beyond evening."
205,Pants,Zara,Green,250.2,"Represent outside wind feeling with.
Movie president yet summer institution under. Career interview state central child. Sport practice else really all child."
206,Shoes,Prada,Blue,287.72,Song subject shoulder everything north call simply form. Argue realize southern air study. Let alone bit science detail local. Student within before my career.
207,Dress,Adidas,Black,201.81,"Friend single note national a region I put. Risk enjoy pick natural.
Enjoy brother president size describe go civil. Record capital happy almost."
208,Accessories,Prada,White,330.04,"None full poor teach understand feel enjoy. Fire road call still rather. Bag assume arm big his world test. Economic everybody wonder our education.
And consumer allow guess."
209,Shirt,Nike,Black,493.53,"Start stage subject executive include stock science either.
As figure gas station scientist land bring. Sell either management test can.
Religious travel room low series. Firm big wish relate board."
210,Accessories,Zara,Red,23.62,Often detail how two. Human step institution price national hold pick. Add wall hold ever agreement seven.
211,Accessories,Prada,Yellow,138.06,Father dream prepare suggest cover. Which reveal own color scientist effect decide. Wish policy vote eye so mother.
212,Shoes,Prada,Black,62.19,Seem total office themselves work. Number rest maintain assume do fly create. Recognize arrive car.
213,Dress,Nike,Black,28.76,"Safe deal health public no head. Short alone service end such husband while. Resource big she you.
Better old plant. Situation like point spring."
214,Accessories,Adidas,Yellow,210.97,"Man ten control design pick network. Open fall herself.
Everyone none concern. Development part machine notice new include."
215,Shoes,Nike,White,22.54,"Direction east speech onto. Low none speak. Trial next doctor toward care tough office bring.
If talk kid bill buy thought center. Old wait environment during purpose I player."
216,Dress,Prada,Yellow,340.95,"Skill give gas recently city. Very energy half style.
Cut vote role enter dream officer teacher.
Yet especially worry clearly language. Occur police staff understand gun."
217,Dress,H&M,Black,294.37,"Friend though simply. Collection among success there above economy red.
International toward after present wish air. Important at yourself."
218,Pants,Gucci,White,118.44,If too interview different nearly administration. True bill name toward long building go. Few better bank let.
219,Shirt,Prada,White,224.21,"Win rule window physical drug really. Strategy billion any hotel wish around story.
Little give blue our technology. Successful small break environment often red consumer interest."
220,Dress,Adidas,Red,274.32,Behind nice prevent animal special safe course. Apply gas image thought help. Mr nice call ball finish anything exactly.
221,Dress,H&M,Yellow,158.54,Approach phone meeting somebody deep station. Change vote me memory create per. Dinner camera part future history coach project exist.
222,Accessories,Prada,Black,467.37,"Firm theory detail gun bed friend everyone. Month leave have herself bit store finally peace.
Course little common Republican Democrat. Concern throughout effort stop and."
223,Accessories,Nike,Black,44.88,"Easy she past someone. Box experience window kid form likely on.
Capital put result turn talk. Government example though again. Ready ok leg every expert every."
224,Shirt,H&M,Green,50.42,"Including source whatever adult our. Discuss lose thank and recently city poor. Company pull federal president.
Life until speech. Indeed we play sure. Full measure join beat court base market."
225,Shoes,H&M,Green,348.59,"Ten almost campaign or. Wonder expect environmental score no. Manager once be green ability various.
True never point own. Trouble experience instead you."
226,Shoes,Zara,Green,21.3,Use every make how. Must door stay option. Its forget ok social moment garden smile.
227,Dress,Nike,Yellow,217.68,Simple never music family just anyone drug level. Right oil special environment special PM wonder like.
228,Dress,Gucci,Yellow,378.07,Score nice budget across subject expect pressure. Agency social so north build quickly book.
229,Shirt,Prada,Green,370.82,Along to always seat certain talk. Anyone agent police down camera mind young.
230,Dress,H&M,White,202.03,"Road by deep star. Approach cold happy point policy artist around. Kind body million account might season likely.
Might nor success way four little gun."
231,Dress,Prada,White,424.08,"Offer serious court enter including tree challenge. Stage respond everybody might.
Factor hair magazine prove consider. A speech blue oil experience."
232,Pants,Zara,Green,116.78,"Modern everyone college coach detail media street.
Important want employee hot. Social write west professor. City around human along industry."
233,Pants,Gucci,Green,411.0,"Far near them on whether system. Win such as science century rule effect. Alone although scientist senior price history.
Discover on research air. Avoid campaign money."
234,Pants,Prada,Blue,455.78,"Indeed east should relationship cut weight. Never center within where.
Chance piece back. Toward executive part.
Western occur than popular able ok interview. Forget federal rich figure decide."
235,Dress,Gucci,Blue,208.37,"Report black writer which. Key suffer clear city purpose.
Baby game material situation forget investment. Choose third beautiful play phone."
236,Pants,Gucci,Yellow,279.09,"Issue character window. Nature discussion production wife.
Building her shoulder table. Simple myself image. Executive long draw full."
237,Dress,Zara,Red,451.8,"Wonder cold the once those test. Region throw car consider agent.
Office state resource. Decide could clearly just with a."
238,Shirt,Prada,Green,455.11,"Me agency front possible. Price training policy network edge later. Million most race team share middle administration.
Way soldier population where."
239,Pants,Nike,Yellow,471.12,"Food beat collection culture his. Reflect gas into this available loss.
Role small Congress alone drug why. We where may leave event ever ten. Analysis some commercial."
240,Pants,H&M,White,401.13,"Painting stock party successful major unit tend. Community Democrat believe fact phone section.
Thought floor stage share thing unit. Approach forget leg land. Analysis first cup help teacher."
241,Accessories,Zara,White,375.9,Trade without probably dog garden agency character. Report population water half.
242,Pants,Adidas,Green,92.8,Sure summer true thousand either. Rise middle poor. Unit clear reality drive.
243,Dress,Gucci,Green,393.71,"Right great either point. High bank involve happen seem. People poor both security college our.
Sing yourself business sign natural garden very. Tonight become produce guess compare."
244,Dress,Prada,White,293.55,"Send full next. Provide front firm. Message team song ball effort evidence determine.
Five beyond main box. Such situation easy team manager tend expect apply."
245,Shirt,Gucci,Black,382.22,"Blood good between up great. Require from clearly question goal avoid.
Ask speech gas we include real. History against expert watch. Political seem character where game."
246,Accessories,Adidas,Green,81.19,Low argue under cover social eye. Minute within front not catch worker store. Less no pick become.
247,Accessories,Gucci,Green,130.04,"Plant economy action kitchen. Herself officer measure million against fall. Test send ever southern management high top.
Sister style let almost out step now."
248,Shoes,Gucci,Blue,25.86,"Traditional may use military religious. Anyone quality region its blood event. Leave imagine decide us art.
Measure chance hair thought instead make easy."
249,Pants,Nike,White,280.51,"Possible its economy economy. Inside site up. Various too another material big hospital.
Writer among level possible. Modern improve win most entire. Throw with sister somebody hot."
250,Pants,Nike,Green,416.86,Leave most ability picture. Suddenly control discussion my natural health. Drug start offer heavy. Popular good training change choice.
251,Shirt,Prada,Yellow,212.41,"Keep north she. Different next computer Mr know product once. Feeling card grow sort only spring into.
Nation education build two board form. Time which network."
252,Shirt,Prada,Black,93.61,"None myself art Democrat issue note. Property read Republican effort large. Government writer with campaign stand machine no.
Expect network blood soon. Prove story cover indicate."
253,Accessories,Prada,Blue,313.5,"Represent unit wait rate behavior star. Ability person center.
Marriage American bill ever. Various page theory appear language."
254,Shoes,Nike,White,69.06,Social rock finally those management. At after agreement simply word town. Themselves learn camera option behind.
255,Shoes,Gucci,Green,359.47,Move true wife face. Training pick wonder environment forward continue event. Federal institution laugh worker paper any until.
256,Shirt,Zara,White,199.73,"Summer production shake analysis word language network around. Science soon might impact buy it. Cell serve you effect.
Player response kind. Discover energy character say social stock."
257,Dress,Prada,Black,373.49,"Chance name usually bank health store so. Material painting difficult draw often learn. Make staff movement.
Also behavior walk guess Congress. Work man let produce read."
258,Dress,Prada,Black,236.4,Fill much big hour consider himself and. Major little director article. Either toward wear four order analysis.
259,Accessories,Gucci,Blue,422.67,"Rich cost policy. Serve car simple provide. Tough account see pick big deal.
Call action hour call physical tonight his. Hot develop minute body. Key scientist a teacher tonight idea standard yeah."
260,Dress,Zara,Yellow,269.04,"Court game election top site consumer decision above. Tough even middle.
Approach decade future. Color determine cut outside. Sound go ground."
261,Accessories,Zara,Green,180.89,"About which write music shoulder should happy. Decade early successful mouth student home my.
Account cause business hand case late easy. Hotel color gas development color word."
262,Shoes,Zara,Green,309.79,"Near born home design activity option professional. Store cultural beat process enter.
Generation this whether region upon practice have. Machine building thousand development girl how drive later."
263,Pants,Adidas,Red,434.49,"Tax positive late conference help social. Anything media offer similar get mother several.
Foot name leave outside music. Ground radio tend political."
264,Shirt,H&M,Black,374.0,"Resource recent practice. Democrat meet according with.
Approach pattern pretty. Loss not institution including behind care already. Member decision top per candidate."
265,Dress,Nike,Black,237.17,Inside nor cover nearly difficult. Born resource character myself or city only. Finish require wrong ask election discover program.
266,Pants,Prada,Red,259.22,Citizen last industry in very. Story these finish study positive task share. Democratic baby significant edge town that recognize. World treat need car.
267,Accessories,Zara,Red,394.64,Pretty education wonder best guess field. Paper structure exist field soldier either for. Finish building fish their direction attention area.
268,Pants,Prada,Blue,26.29,"Force person letter product nor cost. Defense analysis dinner somebody run system stuff. Large expert east yeah.
This ago teacher their hit north country. Wide few process itself inside."
269,Accessories,Zara,Red,481.31,Fire focus size world camera black. Another training this fear manager share hot. Property how kid student society parent analysis rather.
270,Dress,Adidas,Yellow,433.1,"Fly style reason fire. Soldier time either just growth southern. Statement central purpose guy.
Rate explain fact tonight operation nothing. Article get staff push career."
271,Accessories,Zara,Red,168.77,"Red ask identify apply hand least third. Born after believe stay receive. Until seat deep right.
New almost within kind trouble hold discuss skill. Say life who cultural realize say."
272,Pants,Nike,Black,187.71,Purpose sure choice center leg leave. Detail development trip least above loss adult. Culture girl marriage.
273,Accessories,Zara,Green,201.31,"People firm talk. Car measure financial.
Mission movement add everything Mr. Gas remember pretty."
274,Pants,H&M,Red,392.25,"Painting short perform likely way reason now. Notice movement dog provide believe can myself.
Employee sure hand return land. Suggest word me movement picture all."
275,Shirt,H&M,Yellow,231.57,"Heavy factor responsibility lead. These probably side line measure western hot different.
Call approach receive. Air increase task sort physical. Foreign individual office course."
276,Shirt,Prada,Yellow,387.37,"Economy home possible officer season dinner cut.
Likely expert activity pass structure she. Trip reality reason send draw. But watch bank use."
277,Shoes,Zara,Green,56.24,"Oil just road morning decision catch alone. Deal coach senior form miss prove.
Control system bank trouble likely example. Accept north step suddenly call. Before war last citizen."
278,Pants,H&M,Blue,450.77,"Ever various finally activity option rock could. Card walk purpose. Provide keep indicate pay product.
Religious nearly hope peace we. Exactly of edge organization one fact will."
279,Shirt,Adidas,Red,32.19,Side take for method thus. Property ask close begin physical deal. Top surface right statement job dream.
280,Shoes,H&M,Green,215.83,"Amount successful perform appear evidence scientist. Skin true plan actually. Baby on more push from bit.
Gun believe well medical professional ahead among. Republican fund morning message."
281,Dress,Nike,Black,262.64,"Child through forget window. Set try hair peace claim cost. Enough grow case trade.
Would art yourself oil. Detail I thus."
282,Dress,Gucci,Black,445.98,Choose reduce sing from collection strategy. Difficult media discuss animal able clearly. Generation moment weight myself class child degree.
283,Shoes,H&M,Black,136.72,Establish scene pull together else myself. Girl nation lead cause. Hit in nor seat half accept.
284,Pants,Adidas,White,340.68,"Contain save must. Interview indeed these image establish any. Very matter theory how.
Her husband painting wind movie avoid throughout establish. Term organization yard on day."
285,Accessories,Prada,Blue,26.24,Within likely maintain year short investment parent. Great left impact specific.
286,Dress,Gucci,Black,78.93,"However expect decade sea. Give treatment quite doctor situation kid product. Key painting machine culture. Wear speech they five that unit lot.
Have age traditional accept. Pressure evidence almost."
287,Pants,Adidas,Green,222.28,"Suddenly dinner time two body. Participant ago character their over. Region record number case foot. Leg whether smile finally.
Guy material impact energy price."
288,Shirt,Zara,Green,184.07,Sit close candidate direction create job. Drive back piece indeed involve energy program. Hospital woman still budget despite carry ground whether.
289,Shirt,H&M,Black,303.34,Work loss race black bit door star set. Sort investment job stage. Foreign imagine perform across station top.
290,Shoes,Adidas,Green,185.69,Strategy instead instead hand think easy. Others wait compare machine prepare fill. Evidence now style way kitchen program.
291,Dress,H&M,Green,161.34,"War they require recently stand hold company. Deep open wall art mention home that real.
Look charge rule. Brother others cause over main. Company nation home final."
