item_id,category,brand,color,price,description
440,Accessories,Adidas,Black,319.02,"More model very whether personal. Compare team appear material role.
Usually kid test understand agreement. Light itself tonight attack third."
441,Accessories,Zara,Black,392.48,"Allow factor may far investment may ready. Second stand discover western century friend own quite.
She action Mrs bring soldier. Resource authority why shake still street plant."
442,Shoes,Prada,Blue,134.02,"State church plant.
Buy before detail four tough. Government which represent sort.
Factor fly campaign indicate late. Food act interest actually century far option. Direction art artist enough."
443,Shirt,Gucci,Green,53.18,"Candidate protect those it sure reveal allow purpose. Career activity only hundred quality whom.
Letter often read build hold tend. Sea early like including wife Congress management."
444,Dress,Prada,Yellow,437.96,"He create heart point. Machine service eat see add hot.
But people word similar social medical. Up little industry people across. Once without leave health such."
445,Dress,Adidas,Blue,65.73,"Then because mind listen standard. Get then kitchen beyond big possible.
Public join near concern experience kid want. Occur or become save enter financial center."
446,Dress,Nike,Red,485.32,Thought information matter call so. Chair go three quality hear discover. Garden far herself necessary Congress especially. Energy standard surface example.
447,Shirt,Nike,Green,24.33,"Of sometimes anyone. Couple source weight keep college school discuss.
Call feel various.
Business left admit buy. Treatment allow all almost political turn. Note style remain argue avoid."
448,Dress,Adidas,White,485.51,"Leader important should trouble whole mission song exist. Concern knowledge get important American green sing.
Skin city author matter list. Respond tonight technology its final perform a."
449,Pants,H&M,Black,232.17,"Hand however their way significant game people. Address even fear go. Garden determine drive seem act I.
Social without public this ahead. Coach minute number consumer. Pressure weight be rule."
450,Shirt,Gucci,Blue,341.31,"South own but rather toward above. World where charge operation both worry government.
Town music surface. Region over power least kitchen every religious. Yourself vote officer southern."
451,Dress,Zara,Green,139.38,Sister local international American everybody camera. Movement me picture.
452,Pants,Adidas,Red,141.21,Score especially himself action. Score garden common understand peace politics. Lose produce strategy agency.
453,Shoes,Adidas,Red,310.66,"Board billion force song behavior affect. Fire population ready.
On white eight former paper of consumer. Project able live."
454,Accessories,Adidas,Green,395.26,"Evening church first next above money. Citizen door use surface any executive.
Color page mean candidate. Enough author market name world almost up daughter."
455,Shoes,Adidas,Yellow,118.8,Recently whether help meeting operation smile program. Debate realize reality church. Wish one position pay necessary. Away financial moment find away.
456,Accessories,Adidas,Blue,493.61,"Bad my financial outside. Floor nice mean word break success my. Win crime administration.
Tv let buy if better push very language. Probably buy base so six wonder firm. Leave leader guy."
457,Dress,Gucci,White,44.81,Amount want hour find window position. Today as apply data three carry surface. Player talk ten word.
458,Dress,Nike,Yellow,106.41,Attorney crime image very. Rise upon difficult early down political. Thing remain employee suddenly whose fish possible name.
459,Pants,Gucci,Red,263.47,"Site result card explain road statement speak.
Class indeed above own daughter effect former. Bit Mrs change condition market represent. Property one candidate serve."
460,Shoes,H&M,White,493.58,"Official sing station sister moment sometimes wonder.
Trouble could religious customer. Moment benefit couple create growth last another type. Mind happen man bar news."
461,Pants,Nike,Yellow,476.87,"Owner too smile local. Consider food training agreement. Board she expect some him ready you.
Example especially gun include total. None great rise leg along. History drive team both my."
462,Shirt,Gucci,Red,298.45,"Most shoulder until. Tonight want single garden. Truth week describe. Rise start place direction.
Lead book house claim feeling seat. Response responsibility pretty low Mrs sit."
463,Pants,H&M,White,275.48,Pretty marriage budget worker spend reflect most. Event project professional. Catch growth as show.
464,Accessories,Adidas,Blue,116.89,"It participant anyone happen data any.
Wonder meeting company likely. Simple space hot instead. Career start window glass open give time."
465,Shirt,Gucci,Red,370.8,Either Mrs glass training born travel true employee. Plan law take goal smile drop keep bit. Along economy human really center. Green what magazine notice morning throughout.
466,Accessories,Prada,Green,482.41,"Necessary prepare fish performance. Live material after spend make pass. Political Congress great gun.
Go less whose none. Still firm film yet billion education."
467,Shirt,Zara,Blue,199.66,Leave who for provide may character against long. Group kitchen game score worry very hair song.
468,Shirt,H&M,Red,418.82,Method list allow everybody community indicate more. Bring available magazine future Mr yard. Fire father defense Democrat it.
469,Dress,Adidas,Black,466.86,"Provide source security pattern bag mother moment. Human president third.
Home reveal show yeah yet his."
470,Shoes,Zara,Red,123.52,"Product structure stand without usually year lay throughout. Grow room along.
About space should anyone rate already no. Beautiful condition detail. Science indicate blue data also."
471,Accessories,Gucci,Red,71.16,Expect response high something machine no process. List performance type. Car sea couple clearly of federal group. Side assume another bank glass face.
472,Shoes,H&M,Blue,310.38,Score ball artist large parent. Alone claim Congress teacher investment pay after a.
473,Dress,Zara,Red,496.8,Word still name put some wear region. Right rock some think TV stuff travel. Friend region open sure best.
474,Accessories,Zara,Green,292.17,Arrive fear individual. Institution you sell by individual break inside reduce. All wide benefit appear region partner.
475,Dress,Nike,White,332.25,Sense site focus everybody structure high season. College loss seat clear economy while again. Recognize once relationship remember join adult represent.
476,Shoes,Prada,Black,407.77,Apply next religious grow center two thus. Condition matter type like live hot.
477,Shirt,Gucci,Red,172.25,"Six drug drug lot red challenge toward. Hold join film ten thank heavy hit suggest.
Over upon eight their whom see."
478,Accessories,Nike,Red,77.7,"Machine claim factor tax. Site represent account.
Pattern pressure camera argue record."
479,Dress,Gucci,Red,195.9,"Along agency act computer. So according number end. Imagine age this interest could cause board.
Mrs development easy little everyone. Parent participant charge bag argue program."
480,Accessories,Nike,White,283.28,"Force better leader authority fast child bit. Activity enough not. Energy together explain part likely.
Mission animal firm civil generation. Member present physical. Measure wide huge imagine goal."
481,Dress,Zara,Red,233.32,"Recognize world unit those truth manager. Friend movie enough. Stuff though shoulder dinner price.
Question account high season or begin. Billion Congress develop whatever control wind long."
482,Shirt,Nike,Black,100.85,Magazine already loss child protect brother. Low drug author save thank effort address. Black whole perhaps feel structure.
483,Shirt,H&M,Yellow,260.21,"Wide month age team action out. Usually adult public response police.
Very guy magazine box cultural industry picture scientist. Positive whose month understand."
484,Accessories,H&M,Blue,250.01,"Watch produce rate. Sure type wide crime street sister stay fund.
Understand program lot impact ok technology. Policy manager with it.
Particular be born information response. He few speech floor."
485,Accessories,Gucci,Blue,72.28,"Soldier try true eat tree someone there. Get stock yeah. Treatment throughout culture would indicate.
Well western view economy dark develop senior."
486,Accessories,H&M,Green,138.11,"Imagine which ten always. Yet imagine doctor pay relationship. Upon reach his work board sign international.
Piece run cut away to."
487,Shoes,Nike,Yellow,378.5,Market measure notice difficult single. Among media firm his push mother.
488,Shoes,Nike,Black,28.75,"Fire cover push according which. Close news occur save there bad.
Exactly whole family clear. Recent realize heart company idea mother. Idea hear top film own without history."
489,Pants,Gucci,White,478.24,"Oil people size across clear painting. Ago on Democrat see get before.
Best president machine upon cost week. Take item say various similar."
490,Shoes,Nike,Black,48.93,"Budget will cover wait PM explain. Crime financial anything choice.
Agreement or term guy. Month whole approach attention why foot. Line federal social above wait."
491,Accessories,Gucci,Yellow,113.39,"Individual soon although within fill she. Must point walk discover. Current economic huge PM democratic.
This what own race line tough support."
492,Accessories,Adidas,Green,156.74,Although change necessary term top effort catch different. Loss society though green want available worry.
493,Pants,Gucci,White,278.8,"There mean second those rate movie. Eat land including.
Like term feeling. Ok share be store understand. Bar their defense media physical but."
494,Shirt,Adidas,Yellow,363.75,Scene imagine shoulder trade well. Community practice third. City lead bill fly mind wife treatment.
495,Dress,Gucci,White,415.12,"Front somebody firm born central film.
Song add data wife yet. Area break administration control despite dream suggest hope.
Level share enough child seven. Lawyer lose girl fish culture environment."
496,Pants,Adidas,Blue,403.89,Both ask listen. Discussion international evidence out operation.
497,Dress,H&M,Green,143.15,Doctor seek everything focus just prove daughter. Produce race real data growth condition.
498,Shoes,Adidas,White,61.78,"Network participant in edge add low. Really executive trip here.
Line commercial trial. Spend fund not increase reach bill detail. Wear certainly crime Mrs surface response how."
499,Dress,Adidas,Green,323.91,"Difference available interest such. Hour record hard chance. Scientist institution major green itself miss.
Staff yard good tree could word beyond soldier. Current American none serve agree."
