item_id,category,brand,color,price,description
0,Shoes,Gucci,Black,394.25,"Operation parent none sense. Mother child now successful.
State role rock probably. Rock scene blood question prepare think. Everyone far special recent."
1,Accessories,H&M,Black,67.99,Believe everybody early no for especially second exist. Involve little meeting seem rather guess. Head message top anyone run.
2,Pants,Gucci,White,88.58,"Nor matter size suffer admit support environmental. Collection type very cut. Between start strategy democratic cup before adult.
Evening last clear still matter show. Always tell book east five."
3,Pants,Prada,Green,485.56,"War real choice challenge write order series from.
Good this become. Nation while however explain order any season.
Soon professor reason. Level policy series author."
4,Shoes,Prada,Yellow,20.37,"Knowledge fund old message camera budget record. Together benefit know very.
Break lay movie population walk give final. Money yeah enjoy enjoy. Condition kitchen expert account."
5,Shoes,Gucci,Red,166.04,"Owner eat they rest Congress prevent big. Against degree yourself responsibility degree possible if.
The often back society develop indeed. For image where agent."
6,Accessories,Adidas,Red,159.79,"Suddenly describe less pretty movie. Per door fine note.
Major despite nice tend throw offer. Site condition condition common left by. Spend tax difference.
Despite his should trade."
7,Pants,H&M,White,487.4,"List what well offer section common foreign. Dinner me fill. Black body better skill situation Mrs.
Similar ball century prepare must. Away American couple."
8,Pants,Adidas,White,304.36,Within lawyer wide father education law material. While face article name close. During read health project memory feel join especially.
9,Pants,Gucci,Black,346.55,Responsibility everyone son among police top also. Manage see three then away build. Fine step different of police again enter.
10,Dress,H&M,White,472.26,"Arm current card head office face. Everyone challenge Congress far last politics increase. Enjoy eat adult agency reveal prevent.
If possible she plant."
11,Shirt,H&M,Red,27.66,"Well effect send chance option. Executive large kind above clear poor.
Price from tax. Group teach American we something alone laugh. Behavior analysis miss occur process analysis form under."
12,Shirt,Adidas,White,231.27,Sister later face win than ground. Prevent organization imagine safe speak trade. Station money perhaps pretty three wind.
13,Shoes,Gucci,Black,456.47,Open leave watch night respond image so. Other campaign tonight travel everyone everything camera. Expect chance number positive.
14,Shoes,H&M,White,169.62,Technology Republican structure smile employee notice. Step wonder pattern chance guess provide also. Some action probably wear pressure read over.
15,Shirt,Adidas,Yellow,35.03,"Tree occur idea box. We across plant those human.
Threat majority seek kid plan where again sense. Would have meet single positive conference. Product rest score behavior college."
16,Shirt,H&M,White,470.96,"Yes yet others itself job money look. Mother month price address.
Home test painting include establish. Yourself action close customer stock."
17,Shoes,Prada,Yellow,114.07,Hold start identify world according arrive. Back if son open policy language more. Maintain we population which nor may foot. Future newspaper white interesting million security suggest.
18,Dress,Prada,Green,206.57,"While prove might as avoid case leg. Easy type place type ever will win. Water billion suggest second.
Toward name then other none one. Half result candidate cost probably popular teach."
19,Shirt,Gucci,Blue,483.32,"Education father to owner. Think marriage contain call election.
Partner director mind indicate trade. Attack table short message strategy teacher environment president."
20,Shoes,Adidas,Green,87.64,"Into gas government turn cost. Prove cost save key nearly machine outside.
Size exist executive term try if."
21,Accessories,Zara,Red,493.71,"See business everybody together. Security former treatment another task economic beyond.
Quickly so threat final. Stage suffer similar report commercial. Safe most forward its involve majority."
22,Dress,Adidas,Black,115.44,"Grow agency nation I above. Threat conference discuss.
Woman yard cause stand chair officer. Professor size each power. Hold author police ready bad note still."
23,Pants,Nike,Red,310.86,"Officer meet quickly look professor arm. Positive likely reason and finish mind. National husband clearly.
Smile do serve."
24,Shirt,H&M,Red,459.18,Thought attack state politics. West not everything hard manager western majority. According building establish red left exist.
25,Dress,Adidas,Blue,65.8,True mind these happy how. Strategy allow simply lay. Trial room magazine card civil.
26,Accessories,Nike,White,326.03,"Sell administration than hand affect new. Not capital finally serve bit say beat. Far present former dark see realize.
Itself someone raise power force detail activity. Leave season risk artist of."
27,Pants,Nike,Red,203.8,"They Mr mention tonight art degree pressure. Mrs allow factor. Common impact outside.
If list wind eye. Expect adult offer president record positive. Each interesting building somebody ahead."
28,Pants,Zara,Green,289.41,"Agreement size peace pattern yet. Sort and answer traditional product.
Meeting despite before film service."
29,Pants,Zara,Blue,32.2,Involve east ready I billion the. Number center few much. Eat job skill send focus second finally. All us although.
30,Accessories,Nike,Red,170.89,"Keep there history entire trial else action. Seem model direction serious respond rock.
Form between mother drug. Federal meet phone window. White scene choose exist avoid."
31,Shoes,Prada,Green,139.66,Yes blue center painting general keep throughout attack. Finally something case. All significant protect decade light official.
32,Accessories,Nike,Green,129.82,"Present sense improve. List after west back. Conference animal pay child politics audience.
Degree form short everyone record act talk. Sing including stay year home defense involve."
33,Pants,Nike,Yellow,442.62,Past risk mouth sister. White surface much hotel big new. Involve really dark property camera.
34,Shirt,Gucci,Yellow,324.03,"Table help course edge forget. Single concern between Democrat particularly thing. Respond direction rise American same return gas.
Source begin leg several sure. Ago decision partner ok."
35,Shoes,Adidas,White,109.55,Authority truth blue life. Attorney international more win fast within. Democratic picture child out car wide fly.
36,Pants,H&M,White,191.02,Turn expert consumer after mother. Positive hot hope charge strong.
37,Dress,Zara,Red,330.89,Place everyone field TV carry. Treat itself community tonight nation happy policy leader. Back pass last believe machine.
38,Dress,Adidas,Green,433.15,Walk young song yourself. Imagine ball including week could. Director factor girl series government its.
39,Pants,Zara,Yellow,126.61,"Think century poor. Federal executive partner ok. Course people indeed anyone art.
Production notice hand debate blood. By under land example impact."
40,Pants,H&M,White,137.18,"Little during low message industry apply song. Better writer traditional feel only according stage. Tell among most.
West owner cultural relate other. Table will beat."
41,Pants,Prada,Red,213.84,"Short play why bag race. Herself energy bad.
Bank reflect great.
Conference eye authority. Develop decade billion will happy fill interest up. Feeling option sing prevent media rock year she."
42,Dress,H&M,White,138.5,"Attention test group mother so. Somebody establish process seek agent boy.
Message care whether national season. Official agency think natural choice seat. Always age unit source soon above."
43,Shirt,Nike,Red,91.08,Determine yourself card sound pass yeah. Country pretty business everyone realize fine quickly. Fine management bring style receive artist. Factor always respond two baby late rock.
44,Dress,Nike,Red,488.78,"Gas office stock score begin investment foot. Arm president start doctor.
Moment without about scene. Family discussion exactly. Order small fly move watch home fall magazine."
45,Shoes,Prada,Green,185.63,Front picture scientist court star somebody least. Politics senior since look environmental country. Congress body put product ball include. From fine positive challenge board visit ago.
46,Dress,Nike,Yellow,89.55,"Worker left full result certain. Hundred bill blood night entire process. Before consumer any student. Market work time court.
Peace fine we town."
47,Shoes,H&M,Yellow,136.19,"Treat poor per site.
Imagine address check shake ok finish. Seek environment position require note leader read room. Pretty statement little provide board line."
48,Shoes,Nike,Black,136.24,Daughter special learn our. Establish section today left thousand. Education magazine require whose.
49,Accessories,Adidas,Blue,324.09,Effect page question TV adult worker. Church suggest could thing already peace quite. According conference ability pay receive.
50,Pants,Zara,Red,173.97,"Sign development career meeting pull. Item spend meet. Marriage high media benefit test likely.
Successful join little when campaign grow culture. Public conference certain artist."
51,Accessories,Nike,White,176.46,Debate lawyer job north. Democrat attention decision leader receive rule husband. Doctor again body sea.
52,Shoes,Nike,Blue,265.8,"Raise this which. Nice reveal usually beyond radio.
Capital sense over. Book debate able too describe reach. Left pattern reveal nature bill."
53,Pants,Adidas,White,471.45,"Agreement region trial research. Page war thus call majority stage.
Meet authority one dinner threat family. My loss read figure west."
54,Shirt,Zara,Black,183.71,Themselves effort property everyone book right spring. Each best significant bring character. Manage into painting drug.
55,Dress,H&M,Yellow,353.98,"Early describe up discussion fly different. Win wish beautiful.
Win score responsibility maybe listen nor analysis family. Capital long senior chance degree.
Education teacher federal term appear."
56,Shoes,H&M,Red,267.99,"Window right peace serious seven. Church reach computer.
Security indeed major fear sister time. Note well reality think.
Production Republican main particular board sign. Culture one study cover."
57,Dress,H&M,Red,64.69,"For region remember up drop spend. Pay policy such couple lose management difference.
One mind husband tax today sound TV. Today participant will never news American."
58,Shoes,Gucci,Green,443.67,Board table might since remember culture human. Down instead Mr it project happy. Life trial notice follow service soon front.
59,Dress,Zara,Black,356.17,"Music bill author office. Discussion receive leg tough. Arm relate lot over rise.
Car ball light leader. Charge hot treatment but significant both teacher."
60,Pants,Adidas,Yellow,394.34,"Edge common challenge significant idea six positive. Remain health personal first forward often.
Single point play your."
61,Shoes,Nike,Red,97.58,"Respond see now Mr radio road film. Happen western hundred wonder someone public.
Break leg strong her discussion article charge ever. Accept list director bank."
62,Shoes,Prada,Black,198.7,Large model different next PM wonder. Effect treat message eight control arrive. Daughter production figure lot high return charge.
63,Dress,Nike,Red,22.43,Father move history. Consumer investment turn research send eat gas. Send moment certain provide.
64,Shirt,H&M,Yellow,235.24,Anyone finish able avoid realize key. Personal fire red manager seek cup.
65,Accessories,Zara,White,361.85,"Either word management produce his. Court example still during before action answer.
Former top term door protect least exactly not. Season care short ever your."
66,Dress,Prada,Green,105.83,"Onto machine garden why than bit. Executive democratic store before condition forget.
While or suffer deal once building well. Less visit guess where drug. That visit require use."
67,Pants,Zara,Red,280.42,Lead space represent home blue nation either staff. Spend must less free one show oil. Government doctor new husband theory.
68,Pants,Nike,Yellow,147.3,"Politics tough beautiful him thousand talk by next. Start before bar after.
Until coach growth present return. Coach as space member professional her not."
69,Accessories,Nike,Yellow,454.93,"Way pass power behind card between floor.
Everyone across full many back. Sea her southern perhaps support although."
70,Pants,H&M,Green,261.27,"Table important hundred that. Someone tough stop future. He fire agency along walk cut.
Commercial ever result crime final fast. Act catch chance themselves shoulder home family ok."
71,Shoes,Zara,Green,130.49,"After performance make time teacher market. Sing perhaps evidence agent behavior mind.
Option security measure. Player right model office face across bad. Scene general into speech staff first."
72,Pants,Adidas,Black,388.91,Into degree evening pattern beautiful interest blue. Fire today half everything market indicate leave. Black effect up.
73,Dress,Adidas,White,245.57,"Present official list modern suddenly total if thought. System reveal thought service. Accept baby enough.
Wind action office although employee seek baby. Computer kind sound box get."
74,Accessories,Prada,Black,378.91,Both appear hospital available source. Leader senior mean investment area. Several significant every west American both push.
75,Accessories,Gucci,Red,285.33,"Certain marriage ability main toward land. Smile action affect her trouble family.
Reduce factor exactly prevent issue head analysis ball. Tax spring decision improve poor."
76,Pants,Adidas,Red,56.17,Discuss world year generation air pattern yet. Form accept listen final threat. Type itself subject. Whom able capital memory indeed.
77,Accessories,Gucci,Red,172.12,Free leave agency week let particularly town. Decade strategy cover six thought life opportunity. Forget talk air I nearly conference try.
78,Shirt,Zara,Blue,469.35,Car owner laugh responsibility treat high successful. Maybe area when process natural use. Information just machine herself create TV.
79,Shirt,Nike,Yellow,66.64,Mind religious dog film future option. Agreement large reach either industry. Summer report rich.
80,Shirt,Nike,Blue,441.14,"Government democratic both them. Stock wall Congress. Base sister agree whom give compare.
Including stop not together trouble. Personal action market kind within."
81,Dress,Zara,Red,357.19,Recently property middle name later. Toward science become candidate body body. Newspaper see relate decide smile price how.
82,Accessories,H&M,Blue,408.85,"Whether successful truth Democrat great few.
Often character cut able career receive garden. Particular move call case level. Deep eight glass tend anything activity."
83,Dress,Gucci,White,265.44,"Difference shake conference natural think room. College system television image physical we name.
Heavy team local thousand understand probably upon. Rate peace put hit challenge skin."
84,Dress,Adidas,Green,113.25,"Deep often price author deep high group. Instead whether century soon suffer some.
Fly city manager take quickly. Reality assume exactly officer.
Myself hotel local body."
85,Shoes,Nike,White,297.86,"List impact scientist have maintain fact. Tough material possible.
Shake surface soldier crime guess out performance. Too standard ever never own action. Happy everyone inside sure management."
86,Pants,Zara,Blue,280.47,"Debate true capital receive. Mr analysis share pattern.
Although develop opportunity recently head medical. Listen box yet under wide boy. Develop woman lawyer three difference exactly book so."
87,Accessories,Prada,Blue,432.99,"Claim keep continue few night result voice. Level attention save affect business myself professional.
Part choice staff heart. Spring him sound free reflect buy."
88,Dress,Adidas,Blue,414.85,Lawyer ready course TV power. Course easy not glass possible face.
89,Pants,Adidas,Green,270.68,"Cold Republican hundred certainly out rather. Political song discover. Movement moment ok practice.
Provide fill soldier. Other audience discover."
90,Accessories,Adidas,White,483.32,"Market president about. Southern street inside it pass service good.
Pay information thus heavy item he natural. Add them realize police. Pattern option throw ask store."
91,Shoes,Prada,Green,113.3,Kid what almost season personal since very. Wrong food major community.
92,Pants,Adidas,Green,485.38,"Teacher air hard couple card live little bed. Join politics include agent girl young whatever four. Race goal a particular.
One right nation indicate. Fear forward three strategy."
93,Shirt,Prada,Black,401.69,Country hear country color article official. Note technology I technology pull five explain.
94,Pants,Adidas,Blue,57.66,"Society director sport. Her yeah concern upon.
Second citizen police along. Reflect test special avoid evidence serious. American movement start color mission real movement."
95,Accessories,H&M,Green,58.82,Big discussion point idea until wear research. Pretty talk rich. Computer increase claim push consider political.
96,Dress,Adidas,Green,47.93,Yeah out clear American. Seek condition movie open worker true key. Key hand kitchen only together type.
97,Shirt,Zara,Blue,135.1,Ability ready girl him move interest style alone. Assume center exist. Price rule single gun ball look simple. Argue control fall physical onto ago.
98,Dress,Gucci,Green,326.37,Two focus to great since run style. Least environment she administration.
99,Accessories,Gucci,Yellow,370.42,"Do station picture operation. According middle economic bring boy manage night. Argue get tell hold.
Hear reason mention fact activity tend where. Cultural figure figure region."
100,Pants,Adidas,Blue,190.87,"Right save tonight season necessary. Bag several item career.
Too whole here. Series cold reality front spend tough become. Court beyond couple develop."
101,Accessories,Prada,Red,184.1,Power police city. Response treatment walk bank short rich. Drive consider bad standard seat.
102,Shoes,Gucci,Red,169.48,"Become bar whether put window firm voice. Time her Mrs put large. Capital later job including.
Week face improve Mr. Cultural operation PM many."
103,Shoes,Gucci,White,28.24,"Provide another go perform matter dream specific. Close read save film yard.
Language human live book than. Stage option yourself teacher wife past. Claim both check all drug billion suggest."
104,Shirt,Gucci,White,103.14,"Collection before wear determine. I agree describe doctor.
Administration set whom why accept teacher likely. Her different participant information mention street system."
105,Accessories,H&M,Blue,475.59,"Energy report who south easy. Full scene explain security finish not memory like. Economy anything party lot.
Worker mention result. Be road cup father green when."
106,Shoes,H&M,White,199.81,State area agreement behavior nothing continue. Anything because clear star. Key turn young building throughout fish church.
107,Shirt,Nike,Blue,260.5,"Sound score bag suffer.
Guess able performance project Democrat believe. Whether statement catch anything. Travel nor outside mention father one miss."
108,Accessories,Gucci,White,315.61,News prevent treatment blue south. Cold claim decision firm from reach. Themselves choose important product color.
109,Shirt,Zara,White,301.17,"Best ahead once individual woman. That arm everyone receive.
Network PM manager conference training. Season individual economic have door. State young realize enjoy tree toward however."
110,Pants,Adidas,White,206.32,"Professional middle stuff sure wind staff. Save yard teacher shoulder standard red.
Dog official design already. Character section magazine above entire."
111,Shoes,Zara,Red,409.38,"Whose watch food contain fast travel.
Scientist fill sing enjoy. I education mind free listen work participant.
Last true before experience whom."
112,Pants,Gucci,White,205.33,"Benefit against perhaps upon education last. Send child address without.
Avoid risk one. Success home peace owner a stock bill."
113,Dress,H&M,Black,113.98,"Bill early finally especially. Inside mission sign book each.
Control behind state girl program they increase. Industry kitchen eat sell learn join."
114,Accessories,Adidas,Yellow,28.75,"Hotel behind ability plan now month necessary less. Success protect sea inside better expert positive.
Officer room each forget. Cut impact station real security car. Pressure laugh without stop."
115,Pants,H&M,Black,181.55,Away reduce born wrong indeed cold result. Design direction sing toward past. Father community simple gun.
116,Shirt,Gucci,Blue,347.17,Politics drop just purpose hundred lose teach. Entire black case long chance.
117,Shirt,Nike,Red,258.1,"Half attack key policy story nothing.
Future dream believe scientist between guess. Call enter build consider sound. With value between as prevent miss."
118,Shirt,Gucci,Blue,321.89,"Point enter ability this however perhaps trouble. Per small defense street focus add such simply.
Deep risk until TV. Evidence people run civil tough yourself."
119,Accessories,Adidas,Red,405.67,"Soon control those old report. Test upon others same sell. Peace toward generation my loss themselves perhaps.
Institution from lose. Arm order particular."
120,Dress,Adidas,Blue,223.27,Factor hotel plant will on. Husband write sister until. My open sea training leg. Customer drug themselves page ten only else.
121,Pants,Zara,Black,218.06,"Try Republican voice. Wrong physical age court sell level speech goal.
Fly choice admit television wide television. Letter six light cold garden. Nor stuff reflect."
122,Shirt,Zara,Yellow,289.7,Upon baby community weight agency. Half artist official enjoy how. Way our structure bag whose.
123,Shoes,Zara,Green,375.16,Care weight his billion why south. Dark fill professional. Behavior tend anything thousand item develop within.
124,Pants,Zara,Yellow,453.23,Out current without run trial seek practice. Choice attack miss feel little.
125,Shoes,Zara,Yellow,162.86,Catch enter occur director foot any compare. Avoid listen foreign return. Family land tough lawyer thing world common.
126,Pants,Zara,White,25.2,Really development thought create fact. Room such lose several those. Hot paper majority career conference early yard.
127,Dress,Nike,White,190.35,"Fine per system once field. Party identify form.
Race fine both young major arrive. Require rest end open before commercial blood. Chair modern realize with picture reach evidence effort."
128,Shoes,Prada,White,295.25,Tonight name outside chance skill work. Up son rest role. Training politics important hit. Family participant beautiful key effort continue approach.
129,Accessories,Gucci,Black,309.17,"Such per successful organization seat agree assume. Hospital PM four lot imagine eat. Nice eight available memory meet.
Relate report fund. Catch report according travel owner capital."
130,Shoes,Nike,Green,381.14,Particular phone dream before. Collection half detail board not family. Race natural across their study game street.
131,Dress,Gucci,Green,257.32,Behind may decade field red plan land. Almost only deal important measure situation world.
132,Shirt,Gucci,Black,446.1,Line agreement itself to cell senior suggest. Concern care produce sport teacher still degree. Example detail table public. Central doctor without event pass.
133,Pants,Nike,Blue,484.95,"Mouth cell describe positive night. To them list oil board. Through either blood.
Military use doctor realize not about animal. Generation network way more sea ability."
134,Dress,H&M,Blue,316.74,"Partner make face set military. Husband spend year address individual.
Past many else treatment party region."
135,Accessories,Prada,Yellow,356.47,"Let commercial board stop. Summer respond why answer its paper somebody.
Democrat feeling as real go professional."
136,Shirt,Zara,Blue,448.11,Responsibility clear recognize artist game course. Ready indicate world war. Order politics look simple notice one. Edge bank development work live drive join manager.
137,Shirt,Gucci,Green,60.72,Course type environment interview stock our series. During win cover price writer do follow. Week why doctor level never.
138,Pants,Gucci,Red,442.57,"National ahead trouble feel research. Go break law table hear red respond.
Particular stage who community network instead water. Tree goal hear."
139,Dress,Zara,Green,381.62,"Garden attack along before pass myself special. Bit through respond magazine task sing. Look particular newspaper million including also drive.
Government there interview last five attention room."
140,Shoes,Nike,Green,201.43,"It serious although store item field price cost.
Mission party there letter network himself paper war. Like situation change me. Hard either fast fill. Claim onto it article."
141,Pants,H&M,Blue,178.52,Send test onto parent station. Movement old tell summer. Require film magazine must should theory best.
142,Pants,Gucci,Green,214.5,"Enough month challenge. Open people home second hard sometimes.
Enough what agency reality off material Democrat. Treat piece nice enter fear number see."
143,Shirt,Adidas,White,388.25,"Even simply similar. Detail purpose himself apply simple artist city.
Enjoy between guy always necessary especially. Truth current play listen week book. Sound cup particular safe strong."
144,Dress,Zara,Black,300.02,"Around data blue language will Mr sister. Each past play top sort.
Really understand agreement easy war find. Culture that left watch hotel turn."
145,Dress,Adidas,Red,59.79,"Itself fall simply price door protect little nation. Drive try describe news. Very sometimes agreement cut newspaper leg.
As effect mother land happen focus foot. While like place actually."
146,Dress,Prada,Green,482.35,"Base wife mean outside candidate finally. Official once show finally over.
Bag land situation ability."
